{
  "id": "dev-releve-trivial",
  "room": 3,
  "primitives": [
    "LEXIQUE",
    "TOPOLOGIE"
  ],
  "module": "src/puzzles/releve/index.ts",
  "reusesLexiconFrom": [
    "dev-lexique-trivial"
  ],
  "roles": {
    "A": {
      "component": "RelevePanel",
      "canAct": true,
      "sees": [
        "largeur",
        "hauteur",
        "murs",
        "marques",
        "attendus"
      ]
    },
    "B": {
      "component": "ArpentPanel",
      "canAct": true,
      "sees": [
        "ouvertures",
        "grave"
      ]
    }
  },
  "budget": {
    "maxDiscreteElements": 12,
    "targetExchanges": 14,
    "targetMinutes": [
      1,
      2
    ]
  },
  "failure": {
    "costSeconds": 0.5,
    "resetsPuzzle": false,
    "feedback": "informative"
  },
  "dressing": {
    "roomLabel": "FIXTURE DEV",
    "ambientText": "Contenu de developpement. Aucune valeur narrative."
  },
  "content": {
    "_note": "FIXTURE. Lieu minuscule, lexique de la fixture de la salle 1.",
    "lexiqueDe": "room-01",
    "largeur": 4,
    "hauteur": 4,
    "boucles": 0,
    "marques": 5,
    "releves": 3,
    "elementsMin": 5,
    "elementsMax": 12
  }
}
