{
  "id": "dev-topologie-triviale",
  "room": 2,
  "primitives": [
    "TOPOLOGIE"
  ],
  "module": "src/puzzles/topologie/index.ts",
  "roles": {
    "A": {
      "component": "PlanPanel",
      "canAct": true,
      "sees": [
        "largeur",
        "hauteur",
        "murs",
        "depot",
        "jalon"
      ]
    },
    "B": {
      "component": "PostePanel",
      "canAct": true,
      "sees": [
        "ouvertures",
        "surLeDepot",
        "surLeJalon"
      ]
    }
  },
  "budget": {
    "maxDiscreteElements": 8,
    "targetExchanges": 9,
    "targetMinutes": [
      1,
      2
    ]
  },
  "failure": {
    "costSeconds": 0.5,
    "resetsPuzzle": false,
    "feedback": "informative"
  },
  "dressing": {
    "roomLabel": "FIXTURE DEV",
    "ambientText": "Contenu de developpement. Aucune valeur narrative."
  },
  "content": {
    "_note": "FIXTURE. Plan minuscule et sans boucle. Ne jamais copier ce niveau de difficulte dans content/prod.",
    "largeur": 5,
    "hauteur": 5,
    "boucles": 0,
    "distanceMin": 4,
    "distanceMax": 6
  }
}
