{
  "id": "dev-retournement-trivial",
  "room": 5,
  "primitives": [
    "ETAT_CROISE"
  ],
  "module": "src/puzzles/litanie/index.ts",
  "reusesLexiconFrom": [
    "dev-lexique-trivial"
  ],
  "roles": {
    "A": {
      "component": "LitaniePanel",
      "canAct": true,
      "sees": [
        "clavier"
      ]
    },
    "B": {
      "component": "ClavierPanel",
      "canAct": true,
      "sees": [
        "clavier"
      ]
    }
  },
  "budget": {
    "maxDiscreteElements": 5,
    "targetExchanges": 8,
    "targetMinutes": [
      1,
      2
    ]
  },
  "failure": {
    "costSeconds": 0.5,
    "resetsPuzzle": false,
    "feedback": "informative"
  },
  "dressing": {
    "roomLabel": "FIXTURE DEV",
    "ambientText": "Contenu de developpement. Aucune valeur narrative."
  },
  "content": {
    "_note": "FIXTURE. L'inversion reelle de la salle 5 vit dans content/prod.",
    "lexiqueDe": "room-01",
    "longueur": 5,
    "inversion": "ROLES_ECHANGES"
  }
}
